<!ELEMENT productos (producto+)>
<!ELEMENT producto (nombre,descripcion,precio,caracteristicas)>
<!ELEMENT nombre (#PCDATA)>
<!ELEMENT descripcion (#PCDATA)>
<!ELEMENT precio (#PCDATA)>
<!ELEMENT caracteristicas (nombre,valor)>
<!ELEMENT valor (#PCDATA)>